Warning: Using a password on the command line interface can be insecure.
--------------
DELETE FROM equivalentTo
--------------

Query OK, 11 rows affected (0,02 sec)

--------------
DELETE FROM outsideCourse
--------------

Query OK, 16 rows affected (0,02 sec)

--------------
DELETE FROM university
--------------

Query OK, 8 rows affected (0,01 sec)

ERROR 1146 (42S02) at line 6: Table 'ahung44assign2db.westernCSCourse' doesn't exist
--------------
DELETE FROM westernCSCourse
--------------

--------------
SELECT * FROM university
--------------

Empty set (0,00 sec)

--------------
LOAD DATA LOCAL INFILE 'loaddatafall2020.txt' INTO TABLE university
	FIELDS TERMINATED BY ','
	LINES TERMINATED BY '\r\n'
	(UID, UName, city, province, nickname)
--------------

Query OK, 7 rows affected (0,01 sec)
Records: 7  Deleted: 0  Skipped: 0  Warnings: 0

--------------
SELECT * FROM university
--------------

+--------------------------------+-----+-----------+----------+----------+
| UName                          | UID | city      | province | nickname |
+--------------------------------+-----+-----------+----------+----------+
| University Of Toronto          |   2 | Toronto   | ON       | UofT     |
| University of Waterloo         |   4 | Waterloo  | ON       | Waterloo |
| Concordia University           |  24 | Montreal  | QB       | Concord  |
| McMaster University            |  55 | Hamilton  | ON       | Mac      |
| University of British Columbia |  66 | Vancouver | BC       | UBC      |
| Wilfred Laurier University     |  77 | Waterloo  | ON       | Laurier  |
| McGill University              |  88 | Montreal  | QB       | McGill   |
+--------------------------------+-----+-----------+----------+----------+
7 rows in set (0,00 sec)

--------------
SELECT * FROM westernCourse
--------------

+------------+---------------------------------------------+--------+--------+
| westernNum | westernName                                 | Weight | suffix |
+------------+---------------------------------------------+--------+--------+
| cs0020     | Intro to Coding using Pascal and Fortran    |    1.0 |        |
| cs1026     | Computer Science Fundamentals I             |    0.5 | A/B    |
| cs1027     | Computer Science Fundamentals II            |    0.5 | A/B    |
| cs2120     | Modern Survival Skills I: Coding Essentials |    0.5 | A/B    |
| cs2210     | Algorithms and Data Structures              |    1.0 | A/B    |
| cs3000     | Steve Jobs: A Survey                        |    0.5 | A/B    |
| cs3319     | Databases I                                 |    0.5 | A/B    |
| cs4490     | Thesis                                      |    0.5 | Z      |
+------------+---------------------------------------------+--------+--------+
8 rows in set (0,00 sec)

ERROR 1062 (23000) at line 16: Duplicate entry 'cs1026' for key 'PRIMARY'
ERROR 1062 (23000) at line 17: Duplicate entry 'cs1027' for key 'PRIMARY'
ERROR 1062 (23000) at line 18: Duplicate entry 'cs2210' for key 'PRIMARY'
ERROR 1062 (23000) at line 19: Duplicate entry 'cs3319' for key 'PRIMARY'
ERROR 1062 (23000) at line 20: Duplicate entry 'cs2120' for key 'PRIMARY'
ERROR 1062 (23000) at line 21: Duplicate entry 'cs4490' for key 'PRIMARY'
ERROR 1062 (23000) at line 22: Duplicate entry 'cs0020' for key 'PRIMARY'
ERROR 1062 (23000) at line 23: Duplicate entry 'cs3000' for key 'PRIMARY'
--------------
INSERT INTO westernCourse (westernNum, westernName, weight, suffix) VALUES ('cs1026', 'Computer Science Fundamentals I', 0.5, 'A/B')
--------------

--------------
INSERT INTO westernCourse (westernNum, westernName, weight, suffix) VALUES ('cs1027', 'Computer Science Fundamentals II', 0.5, 'A/B')
--------------

--------------
INSERT INTO westernCourse (westernNum, westernName, weight, suffix) VALUES ('cs2210', 'Algorithms and Data Structures', 1.0, "A/B")
--------------

--------------
INSERT INTO westernCourse (westernNum, westernName, weight, suffix) VALUES ('cs3319', 'Databases I', 0.5, "A/B")
--------------

--------------
INSERT INTO westernCourse (westernNum, westernName, weight, suffix) VALUES ('cs2120', 'Modern Survival Skills I: Coding Essentials', 0.5, "A/B")
--------------

--------------
INSERT INTO westernCourse (westernNum, westernName, weight, suffix) VALUES ('cs4490', 'Thesis', 0.5, "Z")
--------------

--------------
INSERT INTO westernCourse (westernNum, westernName, weight, suffix) VALUES ('cs0020', 'Intro to Coding using Pascal and Fortran', 1.0, '')
--------------

--------------
INSERT INTO westernCourse (westernNum, westernName, weight, suffix) VALUES ('cs3000', 'Steve Jobs: A Survey', 0.5, "A/B")
--------------

--------------
SELECT * FROM westernCourse
--------------

+------------+---------------------------------------------+--------+--------+
| westernNum | westernName                                 | Weight | suffix |
+------------+---------------------------------------------+--------+--------+
| cs0020     | Intro to Coding using Pascal and Fortran    |    1.0 |        |
| cs1026     | Computer Science Fundamentals I             |    0.5 | A/B    |
| cs1027     | Computer Science Fundamentals II            |    0.5 | A/B    |
| cs2120     | Modern Survival Skills I: Coding Essentials |    0.5 | A/B    |
| cs2210     | Algorithms and Data Structures              |    1.0 | A/B    |
| cs3000     | Steve Jobs: A Survey                        |    0.5 | A/B    |
| cs3319     | Databases I                                 |    0.5 | A/B    |
| cs4490     | Thesis                                      |    0.5 | Z      |
+------------+---------------------------------------------+--------+--------+
8 rows in set (0,01 sec)

--------------
SELECT * FROM university
--------------

+--------------------------------+-----+-----------+----------+----------+
| UName                          | UID | city      | province | nickname |
+--------------------------------+-----+-----------+----------+----------+
| University Of Toronto          |   2 | Toronto   | ON       | UofT     |
| University of Waterloo         |   4 | Waterloo  | ON       | Waterloo |
| Concordia University           |  24 | Montreal  | QB       | Concord  |
| McMaster University            |  55 | Hamilton  | ON       | Mac      |
| University of British Columbia |  66 | Vancouver | BC       | UBC      |
| Wilfred Laurier University     |  77 | Waterloo  | ON       | Laurier  |
| McGill University              |  88 | Montreal  | QB       | McGill   |
+--------------------------------+-----+-----------+----------+----------+
7 rows in set (0,00 sec)

--------------
INSERT INTO university VALUES ('Oakville University', 72, 'Oakville', 'Ontario', 'Oak')
--------------

Query OK, 1 row affected (0,00 sec)

--------------
SELECT * FROM university
--------------

+--------------------------------+-----+-----------+----------+----------+
| UName                          | UID | city      | province | nickname |
+--------------------------------+-----+-----------+----------+----------+
| University Of Toronto          |   2 | Toronto   | ON       | UofT     |
| University of Waterloo         |   4 | Waterloo  | ON       | Waterloo |
| Concordia University           |  24 | Montreal  | QB       | Concord  |
| McMaster University            |  55 | Hamilton  | ON       | Mac      |
| University of British Columbia |  66 | Vancouver | BC       | UBC      |
| Oakville University            |  72 | Oakville  | Ontario  | Oak      |
| Wilfred Laurier University     |  77 | Waterloo  | ON       | Laurier  |
| McGill University              |  88 | Montreal  | QB       | McGill   |
+--------------------------------+-----+-----------+----------+----------+
8 rows in set (0,00 sec)

--------------
SELECT * FROM outsideCourse
--------------

Empty set (0,00 sec)

--------------
INSERT INTO outsideCourse (outsideNum, outsideName, yearOffered, weight, UID) VALUES ('CompSci022', 'Introduction to Programming', 1, 0.5, 2)
--------------

Query OK, 1 row affected (0,01 sec)

--------------
INSERT INTO outsideCourse (outsideNum, outsideName, yearOffered, weight, UID) VALUES ('CompSci033', 'Intro to Programming for Med students', 3, 0.5, 2)
--------------

Query OK, 1 row affected (0,00 sec)

--------------
INSERT INTO outsideCourse (outsideNum, outsideName, yearOffered, weight, UID) VALUES ('CompSci021', 'Packages', 1, 0.5, 2)
--------------

Query OK, 1 row affected (0,01 sec)

--------------
INSERT INTO outsideCourse (outsideNum, outsideName, yearOffered, weight, UID) VALUES ('CompSci222', 'Introduction to Databases', 2, 1.0, 2)
--------------

Query OK, 1 row affected (0,00 sec)

--------------
INSERT INTO outsideCourse (outsideNum, outsideName, yearOffered, weight, UID) VALUES ('CompSci023', 'Advanced Programming', 1, 0.5, 2)
--------------

Query OK, 1 row affected (0,01 sec)

--------------
INSERT INTO outsideCourse (outsideNum, outsideName, yearOffered, weight, UID) VALUES ('CompSci011', 'Intro to Computer Science', 2, 0.5, 4)
--------------

Query OK, 1 row affected (0,00 sec)

--------------
INSERT INTO outsideCourse (outsideNum, outsideName, yearOffered, weight, UID) VALUES ('CompSci123', 'Using UNIX', 2, 0.5, 4)
--------------

Query OK, 1 row affected (0,00 sec)

--------------
INSERT INTO outsideCourse (outsideNum, outsideName, yearOffered, weight, UID) VALUES ('CompSci021', 'Intro Programming', 1, 1.0, 66)
--------------

Query OK, 1 row affected (0,01 sec)

--------------
INSERT INTO outsideCourse (outsideNum, outsideName, yearOffered, weight, UID) VALUES ('CompSci022', 'Advanced Programming', 1, 0.5, 66)
--------------

Query OK, 1 row affected (0,00 sec)

--------------
INSERT INTO outsideCourse (outsideNum, outsideName, yearOffered, weight, UID) VALUES ('CompSci319', 'Intro Programming', 1, 1.0, 66)
--------------

Query OK, 1 row affected (0,01 sec)

--------------
INSERT INTO outsideCourse (outsideNum, outsideName, yearOffered, weight, UID) VALUES ('CompSci333', 'Graphics', 3, 0.5, 55)
--------------

Query OK, 1 row affected (0,00 sec)

--------------
INSERT INTO outsideCourse (outsideNum, outsideName, yearOffered, weight, UID) VALUES ('CompSci444', 'Networks', 4, 0.5, 55)
--------------

Query OK, 1 row affected (0,01 sec)

--------------
INSERT INTO outsideCourse (outsideNum, outsideName, yearOffered, weight, UID) VALUES ('CompSci022', 'Using Packages', 1, 0.5, 77)
--------------

Query OK, 1 row affected (0,00 sec)

--------------
INSERT INTO outsideCourse (outsideNum, outsideName, yearOffered, weight, UID) VALUES ('CompSci101', 'Introduction to Using Data Structures', 2, 0.5, 77)
--------------

Query OK, 1 row affected (0,01 sec)

--------------
INSERT INTO outsideCourse (outsideNum, outsideName, yearOffered, weight, UID) VALUES ('CompSci555', 'Music AI', 3, 0.5, 72)
--------------

Query OK, 1 row affected (0,00 sec)

--------------
INSERT INTO outsideCourse (outsideNum, outsideName, yearOffered, weight, UID) VALUES ('CompSci777', 'Computers Playing Sports', 3, 0.5, 72)
--------------

Query OK, 1 row affected (0,01 sec)

--------------
SELECT * FROM outsideCourse
--------------

+------------+---------------------------------------+-------------+--------+-----+
| outsideNum | outsideName                           | yearOffered | weight | UID |
+------------+---------------------------------------+-------------+--------+-----+
| CompSci011 | Intro to Computer Science             |           2 |    0.5 |   4 |
| CompSci021 | Packages                              |           1 |    0.5 |   2 |
| CompSci021 | Intro Programming                     |           1 |    1.0 |  66 |
| CompSci022 | Introduction to Programming           |           1 |    0.5 |   2 |
| CompSci022 | Advanced Programming                  |           1 |    0.5 |  66 |
| CompSci022 | Using Packages                        |           1 |    0.5 |  77 |
| CompSci023 | Advanced Programming                  |           1 |    0.5 |   2 |
| CompSci033 | Intro to Programming for Med students |           3 |    0.5 |   2 |
| CompSci101 | Introduction to Using Data Structures |           2 |    0.5 |  77 |
| CompSci123 | Using UNIX                            |           2 |    0.5 |   4 |
| CompSci222 | Introduction to Databases             |           2 |    1.0 |   2 |
| CompSci319 | Intro Programming                     |           1 |    1.0 |  66 |
| CompSci333 | Graphics                              |           3 |    0.5 |  55 |
| CompSci444 | Networks                              |           4 |    0.5 |  55 |
| CompSci555 | Music AI                              |           3 |    0.5 |  72 |
| CompSci777 | Computers Playing Sports              |           3 |    0.5 |  72 |
+------------+---------------------------------------+-------------+--------+-----+
16 rows in set (0,00 sec)

--------------
SELECT * FROM equivalentTo
--------------

Empty set (0,00 sec)

--------------
INSERT INTO equivalentTo VALUES ('cs1026', 'CompSci022', 2, '2015-05-12')
--------------

Query OK, 1 row affected (0,00 sec)

--------------
INSERT INTO equivalentTo VALUES ('cs1026', 'CompSci033', 2, '2013-01-02')
--------------

Query OK, 1 row affected (0,02 sec)

--------------
INSERT INTO equivalentTo VALUES ('cs1026', 'CompSci011', 4, '1997-02-09')
--------------

Query OK, 1 row affected (0,00 sec)

--------------
INSERT INTO equivalentTo VALUES ('cs1026', 'CompSci021', 66, '2010-01-12')
--------------

Query OK, 1 row affected (0,01 sec)

--------------
INSERT INTO equivalentTo VALUES ('cs1027', 'CompSci023', 2, '2017-06-22')
--------------

Query OK, 1 row affected (0,00 sec)

--------------
INSERT INTO equivalentTo VALUES ('cs1027', 'CompSci022', 66, '2019-09-01')
--------------

Query OK, 1 row affected (0,01 sec)

--------------
INSERT INTO equivalentTo VALUES ('cs2210', 'CompSci101', 77, '1998-07-12')
--------------

Query OK, 1 row affected (0,05 sec)

--------------
INSERT INTO equivalentTo VALUES ('cs3319', 'CompSci222', 2, '1990-09-13')
--------------

Query OK, 1 row affected (0,00 sec)

--------------
INSERT INTO equivalentTo VALUES ('cs3319', 'CompSci319', 66, '1987-09-21')
--------------

Query OK, 1 row affected (0,01 sec)

--------------
INSERT INTO equivalentTo VALUES ('cs2120', 'CompSci022', 2, '2018-12-10')
--------------

Query OK, 1 row affected (0,00 sec)

--------------
INSERT INTO equivalentTo VALUES ('cs0020', 'CompSci022', 2, '1999-09-17')
--------------

Query OK, 1 row affected (0,01 sec)

--------------
SELECT * FROM equivalentTo
--------------

+------------+------------+-----+-------------+
| westernNum | outsideNum | UID | dateDecided |
+------------+------------+-----+-------------+
| cs0020     | CompSci022 |   2 | 1999-09-17  |
| cs1026     | CompSci011 |   4 | 1997-02-09  |
| cs1026     | CompSci021 |  66 | 2010-01-12  |
| cs1026     | CompSci022 |   2 | 2015-05-12  |
| cs1026     | CompSci033 |   2 | 2013-01-02  |
| cs1027     | CompSci022 |  66 | 2019-09-01  |
| cs1027     | CompSci023 |   2 | 2017-06-22  |
| cs2120     | CompSci022 |   2 | 2018-12-10  |
| cs2210     | CompSci101 |  77 | 1998-07-12  |
| cs3319     | CompSci222 |   2 | 1990-09-13  |
| cs3319     | CompSci319 |  66 | 1987-09-21  |
+------------+------------+-----+-------------+
11 rows in set (0,00 sec)

--------------
UPDATE equivalentTo SET dateDecided = '2018-09-19' WHERE westernNum = 'cs0020'
--------------

Query OK, 1 row affected (0,00 sec)
Rows matched: 1  Changed: 1  Warnings: 0

--------------
SELECT * from equivalentTo
--------------

+------------+------------+-----+-------------+
| westernNum | outsideNum | UID | dateDecided |
+------------+------------+-----+-------------+
| cs0020     | CompSci022 |   2 | 2018-09-19  |
| cs1026     | CompSci011 |   4 | 1997-02-09  |
| cs1026     | CompSci021 |  66 | 2010-01-12  |
| cs1026     | CompSci022 |   2 | 2015-05-12  |
| cs1026     | CompSci033 |   2 | 2013-01-02  |
| cs1027     | CompSci022 |  66 | 2019-09-01  |
| cs1027     | CompSci023 |   2 | 2017-06-22  |
| cs2120     | CompSci022 |   2 | 2018-12-10  |
| cs2210     | CompSci101 |  77 | 1998-07-12  |
| cs3319     | CompSci222 |   2 | 1990-09-13  |
| cs3319     | CompSci319 |  66 | 1987-09-21  |
+------------+------------+-----+-------------+
11 rows in set (0,00 sec)

--------------
SELECT * FROM outsideCourse
--------------

+------------+---------------------------------------+-------------+--------+-----+
| outsideNum | outsideName                           | yearOffered | weight | UID |
+------------+---------------------------------------+-------------+--------+-----+
| CompSci011 | Intro to Computer Science             |           2 |    0.5 |   4 |
| CompSci021 | Packages                              |           1 |    0.5 |   2 |
| CompSci021 | Intro Programming                     |           1 |    1.0 |  66 |
| CompSci022 | Introduction to Programming           |           1 |    0.5 |   2 |
| CompSci022 | Advanced Programming                  |           1 |    0.5 |  66 |
| CompSci022 | Using Packages                        |           1 |    0.5 |  77 |
| CompSci023 | Advanced Programming                  |           1 |    0.5 |   2 |
| CompSci033 | Intro to Programming for Med students |           3 |    0.5 |   2 |
| CompSci101 | Introduction to Using Data Structures |           2 |    0.5 |  77 |
| CompSci123 | Using UNIX                            |           2 |    0.5 |   4 |
| CompSci222 | Introduction to Databases             |           2 |    1.0 |   2 |
| CompSci319 | Intro Programming                     |           1 |    1.0 |  66 |
| CompSci333 | Graphics                              |           3 |    0.5 |  55 |
| CompSci444 | Networks                              |           4 |    0.5 |  55 |
| CompSci555 | Music AI                              |           3 |    0.5 |  72 |
| CompSci777 | Computers Playing Sports              |           3 |    0.5 |  72 |
+------------+---------------------------------------+-------------+--------+-----+
16 rows in set (0,00 sec)

--------------
UPDATE outsideCourse SET yearOffered = 1 WHERE outsideName LIKE 'Intro%'
--------------

Query OK, 4 rows affected (0,07 sec)
Rows matched: 7  Changed: 4  Warnings: 0

--------------
SELECT * FROM outsideCourse
--------------

+------------+---------------------------------------+-------------+--------+-----+
| outsideNum | outsideName                           | yearOffered | weight | UID |
+------------+---------------------------------------+-------------+--------+-----+
| CompSci011 | Intro to Computer Science             |           1 |    0.5 |   4 |
| CompSci021 | Packages                              |           1 |    0.5 |   2 |
| CompSci021 | Intro Programming                     |           1 |    1.0 |  66 |
| CompSci022 | Introduction to Programming           |           1 |    0.5 |   2 |
| CompSci022 | Advanced Programming                  |           1 |    0.5 |  66 |
| CompSci022 | Using Packages                        |           1 |    0.5 |  77 |
| CompSci023 | Advanced Programming                  |           1 |    0.5 |   2 |
| CompSci033 | Intro to Programming for Med students |           1 |    0.5 |   2 |
| CompSci101 | Introduction to Using Data Structures |           1 |    0.5 |  77 |
| CompSci123 | Using UNIX                            |           2 |    0.5 |   4 |
| CompSci222 | Introduction to Databases             |           1 |    1.0 |   2 |
| CompSci319 | Intro Programming                     |           1 |    1.0 |  66 |
| CompSci333 | Graphics                              |           3 |    0.5 |  55 |
| CompSci444 | Networks                              |           4 |    0.5 |  55 |
| CompSci555 | Music AI                              |           3 |    0.5 |  72 |
| CompSci777 | Computers Playing Sports              |           3 |    0.5 |  72 |
+------------+---------------------------------------+-------------+--------+-----+
16 rows in set (0,00 sec)

Bye
